{
  "schema_version": "1.0",
  "kind": "recovery",
  "id": "synthetic-example",
  "plan_id": "PLAN-001",
  "run_id": "synthetic-example",
  "trigger": "synthetic-example",
  "failed_task_ids": [
    "TASK-001"
  ],
  "review_refs": [],
  "old_graph_ref": "synthetic-example",
  "new_graph_ref": "synthetic-example",
  "action": "repair",
  "new_task_ids": [],
  "superseded_task_ids": [],
  "acceptance_mapping": [
    {
      "original_id": "synthetic-example",
      "new_task_ids": [
        "TASK-001"
      ]
    }
  ],
  "rationale": "synthetic-example",
  "salvage": [],
  "status": "proposed",
  "isolation_review_ref": null,
  "lineage_rewrite_count": 0
}
